content,score
"It's okay, sometimes it works well and sometimes it doesn't, nothing special overall.",5
"""I really enjoy using this app, it's easy to meet interesting people. I'm already meeting someone at least once a week!""


I hope you guys enjoyed my article about ""You are a system that generates realistic user reviews."". If you have any",5
"I've been using this app for a few months now, it's really great! I like that there are so many different ways to interact with others and get new experiences. There is also always some action going on which can be quite exciting!


Example",5
"I really enjoy using this app, it's easy to meet interesting people and everything works well.",5
"I'm really impressed with how much this app does. When I saw it's by Google, I thought ""No way!"", but once you've used it a bit and seen all its functions first hand, it'd be difficult to live without.",5
