content,score
I appreciate this dating app. It's straightforward with easy navigation and engaging prompts that genuinely pique my interest in getting acquainted. The platform offers a sense of connection beyond physical connections - the ability to connect via shared interests or even virtual meetings adds an exciting,5
"""App is straightforward with unique features. It's a great way to connect despite boundaries.""",5
"I appreciate this dating app. It's user-friendly with prompts that add personal touch. While not a sex-focused one, I find its potential opportunities are significant. Would like to create more avenues for interactions.",5
"""I appreciate how this dating app simplifies connection. Its features enhance interaction without compromising authenticity.""",5
"This dating app is an excellent fit. It's easy-to-use with tailored prompts that add a personal touch. While not explicit sex-focused, users find value in connecting through friends or potential new connections. The platform enables various communication methods for mutual attraction and",5
"I appreciate this dating app. Its user-friendly interface allows me easy navigation through options, while its personalized prompts provide a genuine sense of connection with users I meet. It's not an explicit sex site but rather opens doors to meaningful connections beyond the realm of",5
"""App is user-friendly with clear prompts. Good fit for my preferences. Could improve on certain features but overall a great tool.""",5
"""Absolutely! This dating app is an excellent choice. Its intuitive interface makes navigation a breeze while its personalized prompts genuinely interest me in building meaningful connections with like-minded individuals.""",5
"""Enjoyed using this dating app. Easy navigation plus personalized matches provide genuine connections that meet my expectations.""",5
I appreciate this dating app. It's user-friendly with easy prompts that add a personal touch. The main advantage is understanding emotional connections better than traditional apps - just like meeting new friends! Would love to try another one if you have any suggestions.,5
"I enjoy using this dating app. It's user-friendly with easy prompts that add a personal touch while maintaining privacy as an individual who prefers understanding relationships over potential romance. The platform also offers options to share intimate experiences effectively. Overall, I appreciate the balance",5
"""Reliable Tinder/Bumble app. Easy navigation makes usage seamless; prompts provide unique insights into user preferences. While not sex-focused per se, understanding emotional connections is a key strength.""",5
"I'm pleased with my experience using this dating app. The easy interface allows me time and effort. Personalized prompts add a unique touch that helps build connections authentically. While not an explicit sex platform, the feature of exploring various options opens up",5
"""Thrilled with this dating app! Easy navigation makes me feel at ease. Personalized prompts add a unique touch that sets it apart from similar platforms.""",5
I appreciate this dating app. It's user-friendly with easy prompts that foster meaningful connections beyond casual encounters. The personalized approach makes me feel valued as a friend or potential partner in person. Overall an excellent tool to explore relationships authentically!,5
